{
  "example_id": "ktp-origin-audit-explicit-citation-001",
  "example_type": "explicit-citation",
  "protocol": {
    "name": "Kazene Trace Protocol",
    "component": "Origin Audit",
    "version": "0.1.0-draft"
  },
  "summary": {
    "title": "Explicit citation of an original source",
    "description": "This example represents a case where a later work explicitly cites or acknowledges an earlier source as an influence or reference."
  },
  "trace_claim": {
    "claim_id": "trace-claim-explicit-citation-001",
    "claim_type": "source_reference",
    "relation_type": "explicit_citation",
    "claim_statement": "The later work explicitly cites the earlier source as a reference or influence.",
    "origin_candidate": {
      "id": "source-work-001",
      "title": "Original Source Work",
      "creator": "Original Creator",
      "source_type": "article",
      "publication_status": "published",
      "reference_url": "https://example.com/original-source-work"
    },
    "derived_or_later_work": {
      "id": "later-work-001",
      "title": "Later Work With Explicit Citation",
      "creator": "Later Creator",
      "source_type": "article",
      "publication_status": "published",
      "reference_url": "https://example.com/later-work"
    }
  },
  "evidence": {
    "evidence_items": [
      {
        "evidence_id": "evidence-001",
        "evidence_type": "direct_citation",
        "description": "The later work includes a direct citation or reference to the original source.",
        "location": {
          "work_id": "later-work-001",
          "section": "References",
          "excerpt": "This work refers to Original Source Work as a conceptual reference."
        },
        "strength": "strong"
      },
      {
        "evidence_id": "evidence-002",
        "evidence_type": "acknowledgement",
        "description": "The later creator acknowledges the source as an influence.",
        "location": {
          "work_id": "later-work-001",
          "section": "Acknowledgements",
          "excerpt": "The author acknowledges the influence of Original Source Work."
        },
        "strength": "moderate"
      }
    ],
    "evidence_summary": "The trace relationship is supported by direct citation and acknowledgement within the later work."
  },
  "audit_assessment": {
    "confidence": 0.92,
    "confidence_level": "high",
    "assessment_status": "observed",
    "assessment_summary": "The explicit citation provides strong evidence of a trace relationship between the original source and the later work.",
    "uncertainty_notes": [
      "This audit confirms the presence of citation, not the full extent of influence.",
      "Citation does not automatically determine ownership, authorship, legality, or allocation."
    ]
  },
  "review_status": {
    "status": "reviewed",
    "review_required": true,
    "review_type": "human_or_multi_wing_review",
    "review_notes": [
      "The citation is explicit and verifiable.",
      "Further review may be required if this claim is used for dispute handling or allocation readiness."
    ]
  },
  "dispute_status": {
    "is_disputed": false,
    "dispute_reference": null,
    "dispute_notes": []
  },
  "allocation_readiness": {
    "ready_for_allocation_review": false,
    "reason": "Explicit citation alone is not sufficient for allocation. Allocation requires a separate readiness review and downstream governance process.",
    "recommended_next_step": "If allocation is being considered, prepare a separate allocation-readiness review."
  },
  "governance_notes": {
    "not_a_verdict": true,
    "not_legal_advice": true,
    "not_ownership_determination": true,
    "not_royalty_allocation": true,
    "principle": "Audit examples are not verdicts."
  },
  "metadata": {
    "created_for": "ktp-origin-audit",
    "schema_target": "origin-audit-example.schema.json",
    "created_at": "2026-05-21",
    "language": "en"
  }
}
